{
  "$schema": "http://json-schema.org/draft-07/schema#",
  "title": "daily_briefing",
  "description": "Daily briefing output",
  "type": "object",
  "properties": {
    "date": { "type": "string" },
    "focus_items": { "type": "array", "items": { "type": "string" } },
    "people_to_chase": { "type": "array", "items": { "type": "string" } },
    "risks_to_escalate": { "type": "array", "items": { "type": "string" } },
    "pending_approvals": { "type": "array", "items": { "type": "string" } },
    "meetings_to_prepare": { "type": "array", "items": { "type": "string" } },
    "recommended_actions": { "type": "array", "items": { "type": "string" } }
  }
}
