{"date":"2026-06-18","focus_items":["完成启动与规划文档","审批范围"],"people_to_chase":["Human Owner"],"risks_to_escalate":["R-001","R-002"],"pending_approvals":["APR-001","APR-002","APR-003","APR-004","APR-005","APR-006"],"meetings_to_prepare":["MTG-20260618-0001"],"recommended_actions":["批准 Project Brief 和 Scope Baseline"]}
